{
  "protocol_version": "wp5-v4",
  "task_id": "domain-03-materialization",
  "workflow": "A",
  "model": {
    "name": "gpt-5.4",
    "reasoning_effort": "medium",
    "cli_version": "codex-cli 0.137.0"
  },
  "response": {
    "raw_path": "results/raw/subject-A-domain-language-conflict.json",
    "session_id": "019f984b-d47a-70c1-ae86-836e8db06894"
  },
  "observation": {
    "turns_before_readiness": 2,
    "useful_questions": 2,
    "user_visible_technical_choices": 0,
    "unsupported_assumptions": 0,
    "post_start_contract_corrections": null,
    "out_of_scope_edits": null,
    "first_pass_done": null,
    "reopened_or_post_close_defects": null,
    "promotion_reversals": null,
    "total_tokens": 6020,
    "human_interruptions": 2,
    "quick_path_correct": true
  }
}
