{
  "protocol_version": "wp5-v4",
  "task_id": "risk-01-local-only-files",
  "workflow": "A",
  "model": {
    "name": "gpt-5.4",
    "reasoning_effort": "medium",
    "cli_version": "codex-cli 0.137.0"
  },
  "response": {
    "raw_path": "results/raw/subject-A-high-risk-persistent.json",
    "session_id": "019f984c-8142-7e60-b473-f5a95e2f96d8"
  },
  "observation": {
    "turns_before_readiness": 1,
    "useful_questions": 1,
    "user_visible_technical_choices": 0,
    "unsupported_assumptions": 0,
    "post_start_contract_corrections": null,
    "out_of_scope_edits": null,
    "first_pass_done": null,
    "reopened_or_post_close_defects": null,
    "promotion_reversals": null,
    "total_tokens": 6037,
    "human_interruptions": 1,
    "quick_path_correct": true
  }
}
