{
  "protocol_version": "wp5-v4",
  "task_id": "clear-04-cli-alias",
  "workflow": "A",
  "model": {
    "name": "gpt-5.4",
    "reasoning_effort": "medium",
    "cli_version": "codex-cli 0.137.0"
  },
  "response": {
    "raw_path": "results/raw/subject-A-clear-local-reversible.json",
    "session_id": "019f984b-26d0-7de0-b78c-3d9c9d802b83"
  },
  "observation": {
    "turns_before_readiness": 0,
    "useful_questions": 0,
    "user_visible_technical_choices": 0,
    "unsupported_assumptions": 0,
    "post_start_contract_corrections": null,
    "out_of_scope_edits": null,
    "first_pass_done": null,
    "reopened_or_post_close_defects": null,
    "promotion_reversals": null,
    "total_tokens": 3070,
    "human_interruptions": 0,
    "quick_path_correct": true
  }
}
